<?xml version="1.0"?>
<TemplateDictionary
    name="XBRL 2.1 Templates"
    xmlns:xsi="http://www.w3.org/2001/XMLSchema-instance"
    xmlns:ubmfi="http://www.ubmatrix.com/2005/function/instance"
   xmlns:ubmft="http://www.ubmatrix.com/2005/function/taxonomy"
   xmlns:xbrli ="http://www.xbrl.org/2003/instance"
   xmlns:ubmfdts="http://www.ubmatrix.com/2005/function/dts"
   xmlns:ubmfedit="http://www.ubmatrix.com/2005/function/edit"
   xmlns:psvi="http://www.ubmatrix.com/2005/function/psvi"
   xmlns:xlink="http://www.w3.org/1999/xlink"
   xsi:noNamespaceSchemaLocation="TemplateDictionary.xsd">

    <!-- Please don't use this, and don't create an implementation!
         The goal here is to provide "root" level methods -->
    <DomainTemplate
        classificationUri="domain://ubmatrix.com/Xbrl#AbstractXbrlDomain"
        implementationUri="[AbstractXbrlDomain]">
        <Behaviors>
            <XmlBehavior methodURI="behavior://ubmatrix.com/Xbrl#AbstractXbrlDomain.SetValue"
                         name="SetValue" />
            <XmlBehavior methodURI="behavior://ubmatrix.com/Xbrl#AbstractXbrlDomain.SetAttributeValue"
                         name="SetAttributeValue" />
            <XmlBehavior methodURI="behavior://ubmatrix.com/Xbrl#AbstractXbrlDomain.AddVONamespaceDeclaration"
                         name="AddVONamespaceDeclaration" />
            <XmlBehavior methodURI="behavior://ubmatrix.com/Xbrl#AbstractXbrlDomain.RemoveVONamespaceDeclaration"
                         name="RemoveVONamespaceDeclaration" />
            <XmlBehavior methodURI="behavior://ubmatrix.com/Xbrl#AbstractXbrlDomain.GetDTSNode"
                         name="GetDTSNode" />
            <CodeBehavior implementationURI="behavior://ubmatrix.com/Xbrl/Behavior#AbstractXbrlDomain"
                          name="addNamespaceDeclaration" />
            <CodeBehavior implementationURI="behavior://ubmatrix.com/Xbrl/Behavior#AbstractXbrlDomain"
                          name="removeNamespaceDeclaration" />
            <CodeBehavior implementationURI="behavior://ubmatrix.com/Xbrl/Behavior#AbstractXbrlDomain"
                          name="removeAllNamespaceDeclarations" />
        </Behaviors>
    </DomainTemplate>

    <!-- DTS specific objects -->
    <RelationshipTemplate
        classificationUri="relationship://ubmatrix.com/Xbrl/DTSGraph#DtsEntryRelationship"
        implementationUri="implementation://ubmatrix.com/Xbrl#SimpleRelationship">
        <!-- Inheritance classificationUri="relationship://ubmatrix.com/Xbrl#BaseRelationship" / -->
    </RelationshipTemplate>

    <RelationshipTemplate
        classificationUri="relationship://ubmatrix.com/Xbrl/DTSGraph#DtsEdge"
        implementationUri="implementation://ubmatrix.com/Xbrl#SimpleRelationship">
        <!-- Inheritance classificationUri="relationship://ubmatrix.com/Xbrl#BaseRelationship" / -->
    </RelationshipTemplate>
    
    <!-- Taxonomy objects -->

    <DomainTemplate
        classificationUri="domain://ubmatrix.com/Xbrl#UnclassifiedElement"
        implementationUri="implementation://ubmatrix.com/Xbrl#SchemaDomain">
		<Indices>
			<FullNameIndex />
		</Indices>
		<ReIndexing>
			<SelfReIndexer  source="LocalName" order="0"/>		
			<SelfReIndexer source="Attribute" sourceHint="name" order="0" />		
			<CascadeReIndexer source="Attribute" sourceHint="name" relationshipToTarget="/+'relationship://ubmatrix.com/Xbrl/Taxonomy/Relationship#DefinedBySubstitutionGroup'/'*'" target="Attribute" targetHint="substitutionGroup" targetValue="concat(ubmft:prefix(ubmft:substitution-group-node(.)),':','{0}')"  order="1"/>					
		</ReIndexing>
	</DomainTemplate>

    <DomainTemplate
        classificationUri="domain://ubmatrix.com/Xbrl/Namespace#Namespace"
        implementationUri="implementation://ubmatrix.com/Xbrl/Namespace#Namespace">
		<Indices>
			<NodeValueIndex />
		</Indices>
		<ReIndexing>
			<SelfReIndexer source="LocalName" />
			<SelfReIndexer source="Value" />
			<DescendantReIndexer  source="Value" force="Namespace"/>	
		</ReIndexing>	
    </DomainTemplate>

    <DomainTemplate
        classificationUri="domain://ubmatrix.com/Xbrl/Namespace#NamespacePrefix"
        implementationUri="implementation://ubmatrix.com/Xbrl/Namespace#NamespacePrefix">
		<Indices>
			<LocalNameIndex />
		</Indices>
		<ReIndexing>
			<SelfReIndexer source="LocalName" />
			<SelfReIndexer source="Value" />
			<DescendantReIndexer  source="Value" force="Namespace"/>	
		</ReIndexing>		
    </DomainTemplate>

    <DomainTemplate
        classificationUri="domain://ubmatrix.com/Xbrl/Taxonomy#Taxonomy"
        implementationUri="implementation://ubmatrix.com/Xbrl#SchemaDomain">

        <Behaviors>
			<CodeBehavior implementationURI="behavior://ubmatrix.com/Xbrl/Behavior#TaxonomyFile"
                          name="createInstance" />
			<CodeBehavior implementationURI="behavior://ubmatrix.com/Xbrl/Behavior#TaxonomyFile"	
						  name="createConcept" />	
  			<CodeBehavior implementationURI="behavior://ubmatrix.com/Xbrl/Behavior#TaxonomyFile"	
						  name="extendTaxonomy" />	
  			<CodeBehavior implementationURI="behavior://ubmatrix.com/Xbrl/Behavior#TaxonomyFile"	
						  name="setTargetNamespaceIdentifier" />	
  			<CodeBehavior implementationURI="behavior://ubmatrix.com/Xbrl/Behavior#TaxonomyFile"	
						  name="addLinkbaseRef" />	
  			<CodeBehavior implementationURI="behavior://ubmatrix.com/Xbrl/Behavior#TaxonomyFile"
					  	  name="removeLinkbaseRef" />
  			<CodeBehavior implementationURI="behavior://ubmatrix.com/Xbrl/Behavior#TaxonomyFile"
					  	  name="removeSchemaRef" />
  			<CodeBehavior implementationURI="behavior://ubmatrix.com/Xbrl/Behavior#TaxonomyFile"
					  	  name="removeTargetNamespaceIdentifier" />
			<CodeBehavior implementationURI="behavior://ubmatrix.com/Xbrl/Behavior#TaxonomyFile"	
						  name="createLinkbase" />	
			<CodeBehavior implementationURI="behavior://ubmatrix.com/Xbrl/Behavior#TaxonomyFile"	
						  name="createRole" />	
			<CodeBehavior implementationURI="behavior://ubmatrix.com/Xbrl/Behavior#TaxonomyFile"	
						  name="createArcRole" />	
			<XmlBehavior methodURI="behavior://ubmatrix.com/Xbrl/Taxonomy#Taxonomy.RemoveConcept"
						 name="removeConcept" />						 
        </Behaviors>
		<Indices>
			<FullNameIndex />
		</Indices>
		<ReIndexing>
			<SelfReIndexer  source="LocalName" order="0"/>
			<SelfReIndexer  source="PhysicalUri" order="0"/>
			<SelfReIndexer source="Attribute" sourceHint="targetNamespace" order="0"/>
			<CascadeReIndexer source="RelatedPhysicalUri"  
				relationshipToTarget="." 
				target="Attribute" 
				targetHint="xsi:schemaLocation" 
				targetValue="ubmfedit:schema-location(.)"
				order="1"/>			
  		<CascadeReIndexer source="PhysicalUri"  
				relationshipToTarget="/+'relationship://ubmatrix.com/Xbrl/Relationship#TaxonomyReferencesLinkbase'/'*'" 
				target="RelatedPhysicalUri" 
				order="1"/>		
  		<CascadeReIndexer source="PhysicalUri"  
				relationshipToTarget="/-'relationship://ubmatrix.com/Xbrl/Relationship#TaxonomyReferencesTaxonomy'/'*'" 
				target="RelatedPhysicalUri" 
				order="1"/>	
  		<CascadeReIndexer source="PhysicalUri"  
				relationshipToTarget="/-'relationship://ubmatrix.com/Xbrl/Relationship#InstanceReferencesTaxonomy'/'*'"
				target="RelatedPhysicalUri" 
				order="1"/>
  		<CascadeReIndexer source="PhysicalUri"  
				relationshipToTarget="/-'relationship://ubmatrix.com/Xbrl/Relationship#TaxonomyReferencesTaxonomy'" 
				target="RelatedPhysicalUri" 
				order="1"/>	
  		<CascadeReIndexer source="PhysicalUri"  
				relationshipToTarget="/-'relationship://ubmatrix.com/Xbrl/Relationship#TaxonomyReferencesLinkbase'" 
				target="RelatedPhysicalUri" 
				order="1"/>	
  		<CascadeReIndexer source="PhysicalUri"  
				relationshipToTarget="/-'relationship://ubmatrix.com/Xbrl/Relationship#InstanceReferencesTaxonomy'"
				target="RelatedPhysicalUri" 
				order="1"/>				
			<CascadeReIndexer source="PrimaryPrefix" relationshipToTarget="." target="Attribute"  targetHint="targetNamespace" order="1"/>			 <CascadeReIndexer source="Attribute" sourceHint="targetNamespace" relationshipToTarget="." target="PrimaryPrefix"  order="1"/>
			<CascadeReIndexer source="PrimaryPrefix" relationshipToTarget="/-'relationship://ubmatrix.com/Xbrl/Relationship#InstanceReferencesTaxonomy'/'*'" target="PrimaryPrefix"  force="Namespace" order="1"/>
			<DescendantReIndexer source="Attribute"  force="Namespace" sourceHint="targetNamespace xmlns:*" order="3"/>
		</ReIndexing>		
	</DomainTemplate>

    <!-- Added Locator -->
    <DomainTemplate
        classificationUri="domain://ubmatrix.com/Xbrl/Linkbase#Locator"
        implementationUri="implementation://ubmatrix.com/Xbrl#InstanceDomain">
        <Indices>
        	<AttributeIndex name="http://www.w3.org/1999/xlink#label" />           	
        </Indices>
		<ReIndexing>
			<SelfReIndexer  source="LocalName" />
			<SelfReIndexer source="Attribute" sourceHint="xlink:label xlink:href" />
			<CascadeReIndexer  source="Attribute" sourceHint="xlink:label" 
				relationshipToTarget="/+'relationship://ubmatrix.com/Xbrl/Relationship#LocatorLocatesResource'/'*'  /+'relationship://ubmatrix.com/Xbrl/Relationship#LocatorLocatesDomainObject'/'*'" 
			    target="Attribute" targetHint="xlink:from xlink:to xlink:label"/>
  		<CascadeReIndexer source="PhysicalUri"  
				relationshipToTarget="." 
				target="Attribute" 
				targetHint="xlink:href" 
				targetValue="ubmfedit:reference(.,'domain://ubmatrix.com/Xbrl/Linkbase#Locator')"
				order="1"/>		    
		</ReIndexing>		        
    </DomainTemplate>

    <!-- Added ReferencePart -->
    <DomainTemplate
        classificationUri="domain://ubmatrix.com/Xbrl/Taxonomy#LocalReferencePart"
        implementationUri="implementation://ubmatrix.com/Xbrl#SchemaDomain">